Cites,Authors,Title,Year,Source,Publisher,ArticleURL,CitesURL,GSRank,QueryDate,Type,DOI,ISSN,CitationURL,Volume,Issue,StartPage,EndPage,ECC,CitesPerYear,CitesPerAuthor,AuthorCount,Age,Abstract,FullTextURL,RelatedURL
13,"Y Li, CZ Wang, Y Li, J Su","Granularity decision of microservice splitting in view of maintainability and its innovation effect in government data sharing",2020,"Discrete Dynamics in Nature and …","Wiley Online Library","https://onlinelibrary.wiley.com/doi/abs/10.1155/2020/1057902","https://scholar.google.com/scholar?cites=7870342265586109352&as_sdt=2005&sciodt=2007&hl=en",1,"2025-06-12 13:11:36","","10.1155/2020/1057902","","",,,,,13,2.60,3,4,5,"… Therefore, government data sharing is a fundamental and key issue for both academic … platform of data sharing and service connection based on the distributed microservice architecture…","https://onlinelibrary.wiley.com/doi/pdf/10.1155/2020/1057902","https://scholar.google.com/scholar?q=related:qMsAeZcSOW0J:scholar.google.com/&scioq=data+sharing+microservice&hl=en&as_sdt=2007"
35,"Y Yang, Q Zu, P Liu, D Ouyang…","MicroShare: Privacy-preserved medical resource sharing through microservice architecture",2018,"International journal of …","pmc.ncbi.nlm.nih.gov","https://pmc.ncbi.nlm.nih.gov/articles/PMC6036760/","https://scholar.google.com/scholar?cites=14653396120666206144&as_sdt=2005&sciodt=2007&hl=en",2,"2025-06-12 13:11:36","HTML","","","",,,,,35,5.00,7,5,7,"… EE to MicroService for scalability and reliability, and 2) extend EHR resource sharing with additional medical data and … As clinical data is frequently updated, our approach enables data …","https://pmc.ncbi.nlm.nih.gov/articles/PMC6036760/","https://scholar.google.com/scholar?q=related:wG9lfSJSW8sJ:scholar.google.com/&scioq=data+sharing+microservice&hl=en&as_sdt=2007"
0,"M Habib, MA Kabir, L Zheng","LEISA: A Scalable Microservice-based System for Efficient Livestock Data Sharing",2025,"arXiv preprint arXiv:2501.14781","arxiv.org","https://arxiv.org/abs/2501.14781","",3,"2025-06-12 13:11:36","","","","",,,,,0,0.00,0,3,1,"… data sharing architecture [18… of data security and privacy when discussing data sharing, our study is primarily concerned with the mechanisms and processes that facilitate data sharing. …","https://arxiv.org/pdf/2501.14781","https://scholar.google.com/scholar?q=related:fpSBhITUz5UJ:scholar.google.com/&scioq=data+sharing+microservice&hl=en&as_sdt=2007"
116,"R Laigner, Y Zhou, MAV Salles, Y Liu…","Data management in microservices: State of the practice, challenges, and research directions",2021,"arXiv preprint arXiv …","arxiv.org","https://arxiv.org/abs/2103.00170","https://scholar.google.com/scholar?cites=18101663116000553394&as_sdt=2005&sciodt=2007&hl=en",4,"2025-06-12 13:11:36","","","","",,,,,116,29.00,23,5,4,"… Another possibility is to use a single tenant for the states of multiple microservices; however, the latter implies complete sharing. For instance, Figure 1(b) depicts the case where Orders …","https://arxiv.org/pdf/2103.00170","https://scholar.google.com/scholar?q=related:sukAgbIGNvsJ:scholar.google.com/&scioq=data+sharing+microservice&hl=en&as_sdt=2007"
25,"A Smid, R Wang, T Cerny","Case study on data communication in microservice architecture",2019,"Proceedings of the Conference on Research …","dl.acm.org","https://dl.acm.org/doi/abs/10.1145/3338840.3355659","https://scholar.google.com/scholar?cites=2541336177285429585&as_sdt=2005&sciodt=2007&hl=en",5,"2025-06-12 13:11:36","","10.1145/3338840.3355659","","",,,,,25,4.17,8,3,6,"… Performance increase: The design solution proposed in example 2 is not a pure microservice since the services share a single database. However, the distribution is achieved by …","https://www.researchgate.net/profile/Tom-Cerny/publication/337200845_Case_study_on_data_communication_in_microservice_architecture/links/5ee2960b92851ce9e7dca840/Case-study-on-data-communication-in-microservice-architecture.pdf","https://scholar.google.com/scholar?q=related:UXny5cmjRCMJ:scholar.google.com/&scioq=data+sharing+microservice&hl=en&as_sdt=2007"
4,"SK Gan, TL Wong, CP Goh, WP Lee…","A Review on the Development of Dataspace Connectors using Microservices Cross-Company Secured Data Exchange",2021,"… Conference on Digital …","tarc.edu.my","https://www.tarc.edu.my/files/icdxa/proceeding_new/2EAC365D-77C2-4321-AE28-862542D2CBEA.pdf","https://scholar.google.com/scholar?cites=1861581452317810063&as_sdt=2005&sciodt=2007&hl=en",6,"2025-06-12 13:11:36","PDF","","","",,,,,4,1.00,1,5,4,"… Therefore, the data exchange architecture that involves the dataspace connectors that … of data with high volume, high velocity and high availability. To handle the data communication, …","https://www.tarc.edu.my/files/icdxa/proceeding_new/2EAC365D-77C2-4321-AE28-862542D2CBEA.pdf","https://scholar.google.com/scholar?q=related:j93bwXeq1RkJ:scholar.google.com/&scioq=data+sharing+microservice&hl=en&as_sdt=2007"
15,"Y Liu, B Yang, Y Wu, C Chen…","How to share: Balancing layer and chain sharing in industrial microservice deployment",2022,"IEEE Transactions on …","ieeexplore.ieee.org","https://ieeexplore.ieee.org/abstract/document/9993766/","https://scholar.google.com/scholar?cites=16239769163736255796&as_sdt=2005&sciodt=2007&hl=en",7,"2025-06-12 13:11:36","","","","",,,,,15,5.00,3,5,3,"… sharing is chain sharing [18], [19], which can be defined as the data sharing of microservices … of layer sharing and chain sharing through a simple microservice deployment model. As …","https://arxiv.org/pdf/2212.14183","https://scholar.google.com/scholar?q=related:NI3XLgNAX-EJ:scholar.google.com/&scioq=data+sharing+microservice&hl=en&as_sdt=2007"
15,"K Alanezi, S Mishra","Utilizing microservices architecture for enhanced service sharing in IoT edge environments",2022,"IEEE Access","ieeexplore.ieee.org","https://ieeexplore.ieee.org/abstract/document/9864183/","https://scholar.google.com/scholar?cites=16638740727902853289&as_sdt=2005&sciodt=2007&hl=en",8,"2025-06-12 13:11:36","","","","",,,,,15,5.00,8,2,3,"… microservices, constructing an IoT application by interconnecting these microservices, and potential sharing of microservices … microservice, we need to work on launching the DataStore …","https://ieeexplore.ieee.org/iel7/6287639/9668973/09864183.pdf","https://scholar.google.com/scholar?q=related:qVh5RImu6OYJ:scholar.google.com/&scioq=data+sharing+microservice&hl=en&as_sdt=2007"
73,"C Esposito, A Castiglione…","Security and privacy for cloud-based data management in the health network service chain: a microservice approach",2017,"IEEE Communications …","ieeexplore.ieee.org","https://ieeexplore.ieee.org/abstract/document/8030494/","https://scholar.google.com/scholar?cites=16579847492523896911&as_sdt=2005&sciodt=2007&hl=en",9,"2025-06-12 13:11:36","","","","",,,,,73,9.13,24,3,8,"… fruition by means of mobile computing and easy sharing of medical data within a country or across borders. In addition, alongside the introduction of cloud computing within healthcare, …","","https://scholar.google.com/scholar?q=related:T7AJXnNzF-YJ:scholar.google.com/&scioq=data+sharing+microservice&hl=en&as_sdt=2007"
2,"W Li, ZT Li, Z Yan, Y Liu, D Zeng, H Yu, W Chen…","A data encryption and file sharing framework among microservices-based edge nodes with blockchain",2025,"Peer-to-Peer Networking …","Springer","https://link.springer.com/article/10.1007/s12083-024-01856-y","https://scholar.google.com/scholar?cites=11692431899633989170&as_sdt=2005&sciodt=2007&hl=en",10,"2025-06-12 13:11:36","","10.1007/s12083-024-01856-y","","",,,,,2,2.00,0,8,1,"… for data sharing. … data communication between microservices in edge groups and large file transfers between edge nodes in larger groups. The framework demonstrated stable data …","","https://scholar.google.com/scholar?q=related:MjYhEt3cQ6IJ:scholar.google.com/&scioq=data+sharing+microservice&hl=en&as_sdt=2007"
12,"M Labiadh, C Obrecht, C Ferreira da Silva…","A microservice-based framework for exploring data selection in cross-building knowledge transfer",2021,"… Oriented Computing and …","Springer","https://link.springer.com/article/10.1007/s11761-020-00306-w","https://scholar.google.com/scholar?cites=11969007212561518595&as_sdt=2005&sciodt=2007&hl=en",11,"2025-06-12 13:11:36","","10.1007/s11761-020-00306-w","","",,,,,12,3.00,3,4,4,"… data selection to tackle the domain shift challenge in the context of domain generalization. We also propose a microservice-… Whereas MSA minimizes the need to share components …","https://arxiv.org/pdf/2102.12970","https://scholar.google.com/scholar?q=related:A1DRMqV0GqYJ:scholar.google.com/&scioq=data+sharing+microservice&hl=en&as_sdt=2007"
6,"W Xiaojun, S Xu, H Zhe…","Research on the construction of resource sharing platform based on microservice",2017,"… Conference on Smart Grid …","ieeexplore.ieee.org","https://ieeexplore.ieee.org/abstract/document/8104486/","https://scholar.google.com/scholar?cites=5075292155714645869&as_sdt=2005&sciodt=2007&hl=en",12,"2025-06-12 13:11:36","","","","",,,,,6,0.75,2,4,8,"… ), the Canadian national network to share the learning resource library EduSource project, … data standard, unified resource platform, unified database system, realize data sharing and …","","https://scholar.google.com/scholar?q=related:ba-yWFMPb0YJ:scholar.google.com/&scioq=data+sharing+microservice&hl=en&as_sdt=2007"
137,"S Roca, J Sancho, J García, Á Alesanco","Microservice chatbot architecture for chronic patient support",2020,"Journal of biomedical informatics","Elsevier","https://www.sciencedirect.com/science/article/pii/S1532046419302242","https://scholar.google.com/scholar?cites=9454653026570960302&as_sdt=2005&sciodt=2007&hl=en",13,"2025-06-12 13:11:36","HTML","","","",,,,,137,27.40,34,4,5,"… In this paper, we introduce a chatbot architecture for chronic patient support grounded on three pillars: scalability by means of microservices, standard data sharing models through HL7 …","https://www.sciencedirect.com/science/article/pii/S1532046419302242","https://scholar.google.com/scholar?q=related:rn1Vs9WsNYMJ:scholar.google.com/&scioq=data+sharing+microservice&hl=en&as_sdt=2007"
43,"J Innerbichler, S Gonul…","NIMBLE collaborative platform: Microservice architectural approach to federated IoT",2017,"2017 Global Internet …","ieeexplore.ieee.org","https://ieeexplore.ieee.org/abstract/document/8016216/","https://scholar.google.com/scholar?cites=224636185573077959&as_sdt=2005&sciodt=2007&hl=en",14,"2025-06-12 13:11:36","","","","",,,,,43,5.38,14,3,8,"… approach utilizes microservice technology, … microservices in practice, we present two scenarios, both related to manufacturing of wooden home buildings: one is IoT-based data sharing …","","https://scholar.google.com/scholar?q=related:xzPIrGsRHgMJ:scholar.google.com/&scioq=data+sharing+microservice&hl=en&as_sdt=2007"
137,"Y Wang, H Kadiyala, J Rubin","Promises and challenges of microservices: an exploratory study",2021,"Empirical Software Engineering","Springer","https://link.springer.com/article/10.1007/s10664-020-09910-y","https://scholar.google.com/scholar?cites=3289105197518074957&as_sdt=2005&sciodt=2007&hl=en",15,"2025-06-12 13:11:36","","10.1007/s10664-020-09910-y","","",,,,,137,34.25,46,3,4,"… While we cannot share the names of the companies due to confidentiality reasons, we report … can access the appropriate data: P2: «Machine learning has access to user data, so we …","https://people.ece.ubc.ca/~mjulia/publications/Microservices_EMSE_2021.pdf","https://scholar.google.com/scholar?q=related:TbT0LsA_pS0J:scholar.google.com/&scioq=data+sharing+microservice&hl=en&as_sdt=2007"
28,"Z Li, D Seco, AE Sánchez Rodríguez","Microservice-oriented platform for internet of big data analytics: A proof of concept",2019,"Sensors","mdpi.com","https://www.mdpi.com/1424-8220/19/5/1134","https://scholar.google.com/scholar?cites=5609056986841583651&as_sdt=2005&sciodt=2007&hl=en",16,"2025-06-12 13:11:36","HTML","","","",,,,,28,4.67,9,3,6,"… This article mainly portrays the proof of concept of the microservice-oriented platform for IoBDA, … IoT-friendly data processing logics and gradually migrating them to the microservices …","https://www.mdpi.com/1424-8220/19/5/1134","https://scholar.google.com/scholar?q=related:I5CdiZxf100J:scholar.google.com/&scioq=data+sharing+microservice&hl=en&as_sdt=2007"
33,"E Ntentos, U Zdun, K Plakidas, D Schall, F Li…","Supporting architectural decision making on data management in microservice architectures",2019,"… Conference, ECSA 2019 …","Springer","https://link.springer.com/chapter/10.1007/978-3-030-29983-5_2","https://scholar.google.com/scholar?cites=5436052772726716331&as_sdt=2005&sciodt=2007&hl=en",17,"2025-06-12 13:11:36","","10.1007/978-3-030-29983-5_2","","",,,,,33,5.50,6,6,6,"… Section 4 describes our reusable ADD model on microservice data management. … Data sharing must be considered for each data object that is shared between at least two microservices…","https://eprints.cs.univie.ac.at/6071/7/paper.pdf","https://scholar.google.com/scholar?q=related:qzenAjK9cEsJ:scholar.google.com/&scioq=data+sharing+microservice&hl=en&as_sdt=2007"
1,"S Pfleger","Data Security in Microservice-Systems",2024,"","pub.fh-campuswien.ac.at","https://pub.fh-campuswien.ac.at/obvfcwhsacc/content/titleinfo/10215346/full.pdf","https://scholar.google.com/scholar?cites=3103939587107569400&as_sdt=2005&sciodt=2007&hl=en",18,"2025-06-12 13:11:36","PDF","","","",,,,,1,1.00,1,1,1,"… Microservice architectures are widely used in software development today. In the EU the processing of personal data in microservice systems must comply with the General Data …","https://pub.fh-campuswien.ac.at/obvfcwhsacc/content/titleinfo/10215346/full.pdf","https://scholar.google.com/scholar?q=related:-L7R7ZtoEysJ:scholar.google.com/&scioq=data+sharing+microservice&hl=en&as_sdt=2007"
3,"L Tang, H Hu, Z Wang, J Wang, Y Li","Microservice architecture design for big data in tactical cloud",2020,"Big Data and Security: First …","Springer","https://link.springer.com/chapter/10.1007/978-981-15-7530-3_31","https://scholar.google.com/scholar?cites=9367428084562066029&as_sdt=2005&sciodt=2007&hl=en",19,"2025-06-12 13:11:36","","10.1007/978-981-15-7530-3_31","","",,,,,3,0.60,1,5,5,"… With the rapid development of emerging technologies such as big data and cloud computing, the research on the “Tactical Cloud” with resource awareness, real-time data sharing and …","","https://scholar.google.com/scholar?q=related:bfpWTzbK_4EJ:scholar.google.com/&scioq=data+sharing+microservice&hl=en&as_sdt=2007"
85,"N Singh, Y Hamid, S Juneja, G Srivastava…","Load balancing and service discovery using Docker Swarm for microservice based big data applications",2023,"Journal of Cloud …","Springer","https://link.springer.com/article/10.1186/s13677-022-00358-7","https://scholar.google.com/scholar?cites=14989383611724295877&as_sdt=2005&sciodt=2007&hl=en",20,"2025-06-12 13:11:36","HTML","10.1186/s13677-022-00358-7","","",,,,,85,42.50,17,5,2,"… container instances are comparatively sharing similar workloads. Therefore, based on these results, it is concluded that containerized microservices for big data applications based on …","https://link.springer.com/article/10.1186/s13677-022-00358-7","https://scholar.google.com/scholar?q=related:xW7jSvr8BNAJ:scholar.google.com/&scioq=data+sharing+microservice&hl=en&as_sdt=2007"
34,"K Miao, J Li, W Hong, M Chen","A Microservice‐Based Big Data Analysis Platform for Online Educational Applications",2020,"Scientific Programming","Wiley Online Library","https://onlinelibrary.wiley.com/doi/abs/10.1155/2020/6929750","https://scholar.google.com/scholar?cites=1392367843683592187&as_sdt=2005&sciodt=2007&hl=en",21,"2025-06-12 13:11:36","","10.1155/2020/6929750","","",,,,,34,6.80,9,4,5,"… environment sharing, data sharing, and model sharing have become mainstream workflows. Of course, a personal workspace based on sharing conditions is also essential. …","https://onlinelibrary.wiley.com/doi/pdf/10.1155/2020/6929750","https://scholar.google.com/scholar?q=related:--dvPy2vUhMJ:scholar.google.com/&scioq=data+sharing+microservice&hl=en&as_sdt=2007"
38,"JA Bigheti, MM Fernandes…","Control as a service: a microservice approach to Industry 4.0",2019,"2019 II Workshop on …","ieeexplore.ieee.org","https://ieeexplore.ieee.org/abstract/document/8792918/","https://scholar.google.com/scholar?cites=16428201521701361735&as_sdt=2005&sciodt=2007&hl=en",22,"2025-06-12 13:11:36","","","","",,,,,38,6.33,13,3,6,"… ; microservices do not share databases (each microservice manages its own data); microservices do not share source code, but can use common libraries; each microservice can be …","https://www.researchgate.net/profile/Eduardo-Godoy-2/publication/335138663_Control_as_a_Service_A_Microservice_Approach_to_Industry_40/links/5e5aafa3a6fdccbeba0f1c4a/Control-as-a-Service-A-Microservice-Approach-to-Industry-40.pdf","https://scholar.google.com/scholar?q=related:R5iKXz6y_OMJ:scholar.google.com/&scioq=data+sharing+microservice&hl=en&as_sdt=2007"
128,"A Furda, C Fidge, O Zimmermann, W Kelly…","Migrating enterprise legacy source code to microservices: on multitenancy, statefulness, and data consistency",2017,"Ieee …","ieeexplore.ieee.org","https://ieeexplore.ieee.org/abstract/document/8186442/","https://scholar.google.com/scholar?cites=3741713378369419086&as_sdt=2005&sciodt=2007&hl=en",23,"2025-06-12 13:11:36","","","","",,,,,128,16.00,26,5,8,"… It enables organizations that demand complete autonomy in the administration of their users and associated data to share access to the same physical instances of the system and to …","https://www.researchgate.net/profile/Andrei-Furda/publication/321198405_Migrating_Enterprise_Legacy_Source_Code_to_Microservices_On_Multi-Tenancy_Statefulness_and_Data_Consistency/links/5c9866f445851506d7295afd/Migrating-Enterprise-Legacy-Source-Code-to-Microservices-On-Multi-Tenancy-Statefulness-and-Data-Consistency.pdf","https://scholar.google.com/scholar?q=related:TjcJQX487TMJ:scholar.google.com/&scioq=data+sharing+microservice&hl=en&as_sdt=2007"
13,"H Liu, L Qi, S Shen, AA Khan…","Microservice‐driven privacy‐aware cross‐platform social relationship prediction based on sequential information",2024,"software: Practice and …","Wiley Online Library","https://onlinelibrary.wiley.com/doi/abs/10.1002/spe.3240","https://scholar.google.com/scholar?cites=13556899932101732214&as_sdt=2005&sciodt=2007&hl=en",24,"2025-06-12 13:11:36","","10.1002/spe.3240","","",,,,,13,13.00,3,5,1,"… In fact, in a microservice environment, each microservice can … the microservice architecture enables data and function sharing … of user-available data information across these various …","https://www.researchgate.net/profile/Arif-Khan-23/publication/373020350_Microservice-driven_privacy-aware_cross-platform_social_relationship_prediction_based_on_sequential_information/links/64d4caedd3e680065aac503c/Microservice-driven-privacy-aware-cross-platform-social-relationship-prediction-based-on-sequential-information.pdf","https://scholar.google.com/scholar?q=related:dudwJKnII7wJ:scholar.google.com/&scioq=data+sharing+microservice&hl=en&as_sdt=2007"
24,"K Munonye, P Martinek","Evaluation of data storage patterns in microservices archicture",2020,"2020 IEEE 15th International …","ieeexplore.ieee.org","https://ieeexplore.ieee.org/abstract/document/9130516/","https://scholar.google.com/scholar?cites=459848372201342031&as_sdt=2005&sciodt=2007&hl=en",25,"2025-06-12 13:11:36","","","","",,,,,24,4.80,12,2,5,"… While microservices offer a wide range of benefits over the monolithic architecture, other challenges arise relating to complexity, inter-communication between services, data sharing …","","https://scholar.google.com/scholar?q=related:T0Sae6i1YQYJ:scholar.google.com/&scioq=data+sharing+microservice&hl=en&as_sdt=2007"
13,"W Lu, Q Xu, C Lan, L Lyu, Y Zhou…","Microservice‐Based Platform for Space Situational Awareness Data Analytics",2020,"International Journal of …","Wiley Online Library","https://onlinelibrary.wiley.com/doi/abs/10.1155/2020/8149034","https://scholar.google.com/scholar?cites=3216226945340923459&as_sdt=2005&sciodt=2007&hl=en",26,"2025-06-12 13:11:36","","10.1155/2020/8149034","","",,,,,13,2.60,2,6,5,"… of X as a Service (XaaS), we propose a microservice-based platform for SSA data analytics to promote the sharing of SSA information and provide convenient and efficient services to …","https://onlinelibrary.wiley.com/doi/pdf/10.1155/2020/8149034","https://scholar.google.com/scholar?q=related:Q94V0l1VoiwJ:scholar.google.com/&scioq=data+sharing+microservice&hl=en&as_sdt=2007"
8,"J Lian, M Gao","Design and implementation of network information service platform based on microservice architecture",2020,"Journal of Physics: Conference Series","iopscience.iop.org","https://iopscience.iop.org/article/10.1088/1742-6596/1678/1/012094/meta","https://scholar.google.com/scholar?cites=5464536117082340460&as_sdt=2005&sciodt=2007&hl=en",27,"2025-06-12 13:11:36","","10.1088/1742-6596/1678/1/012094","","",,,,,8,1.60,4,2,5,"… microservice platform business. The establishment of the data sharing engine helps the data exchange from the data … table of the microservice is mapped to the standard data center, so …","https://iopscience.iop.org/article/10.1088/1742-6596/1678/1/012094/pdf","https://scholar.google.com/scholar?q=related:bDz8aKXu1UsJ:scholar.google.com/&scioq=data+sharing+microservice&hl=en&as_sdt=2007"
46,"MD Hossain, T Sultana, S Akhter, MI Hossain, NT Thu…","The role of microservice approach in edge computing: Opportunities, challenges, and research directions",2023,"ICT Express","Elsevier","https://www.sciencedirect.com/science/article/pii/S2405959523000760","https://scholar.google.com/scholar?cites=12490680650637377078&as_sdt=2005&sciodt=2007&hl=en",28,"2025-06-12 13:11:36","HTML","","","",,,,,46,23.00,8,6,2,"… microservice designs in cloud data centers to reduce operating expenses. But during peak traffic hours, data … On the other hand, Alanezi and Mishra [62] proposed sharing microservices …","https://www.sciencedirect.com/science/article/pii/S2405959523000760","https://scholar.google.com/scholar?q=related:Nv4VkN_PV60J:scholar.google.com/&scioq=data+sharing+microservice&hl=en&as_sdt=2007"
20,"NC Sheffield, VR Bonazzi, PE Bourne, T Burdett…","From biomedical cloud platforms to microservices: next steps in FAIR data and analysis",2022,"Scientific Data","nature.com","https://www.nature.com/articles/s41597-022-01619-5","https://scholar.google.com/scholar?cites=17274518996910826294&as_sdt=2005&sciodt=2007&hl=en",29,"2025-06-12 13:11:36","HTML","","","",,,,,20,6.67,4,5,3,"… In our experience, biomedical cloud platforms, while frequently built on the premise of simplifying data sharing and interoperability, are not generally delivering on this promise. Instead, …","https://www.nature.com/articles/s41597-022-01619-5","https://scholar.google.com/scholar?q=related:NmOb3IBru-8J:scholar.google.com/&scioq=data+sharing+microservice&hl=en&as_sdt=2007"
651,"N Alshuqayran, N Ali, R Evans","A systematic mapping study in microservice architecture",2016,"2016 IEEE 9th international …","ieeexplore.ieee.org","https://ieeexplore.ieee.org/abstract/document/7796008/","https://scholar.google.com/scholar?cites=11364443780737005286&as_sdt=2005&sciodt=2007&hl=en",30,"2025-06-12 13:11:36","","","","",,,,,651,72.33,217,3,9,"… data that is frequently used by a single microservice is owned by another. This requires creating data sharing … communication overhead caused by data copying which happens during …","https://bura.brunel.ac.uk/bitstream/2438/14968/1/FullText.pdf","https://scholar.google.com/scholar?q=related:5va5PGidtp0J:scholar.google.com/&scioq=data+sharing+microservice&hl=en&as_sdt=2007"
