Authors,Title,Year,Source,Inclusion Decision,Reason
"E Ntentos, U Zdun, K Plakidas, D Schall, F Li…",Supporting architectural decision making on data management in microservice architectures,2019,"… Conference, ECSA 2019 …",No,Excluded (E3): Out of scope for policy modeling or code generation
"K Afachao, AM Abu-Mahfouz, GP Hanke",Efficient microservice deployment in the edge-cloud networks with policy-gradient reinforcement learning,2024,IEEE Access,No,Excluded (E3): Out of scope for policy modeling or code generation
T Panagos,Policy Fabric And Sharing System For Enabling Multi-Party Data Processing In An IoT Environment,2018,"US Patent App. 15/848,807",No,Excluded (E2): Technical system implementation without policy modeling
"M Sauwens, E Heydari Beni, K Jannes…",ThunQ: A distributed and deep authorization middleware for early and lazy policy enforcement in microservice applications,2021,"… , ICSOC 2021, Virtual …",No,Excluded (E3): Out of scope for policy modeling or code generation
"W Li, ZT Li, Z Yan, Y Liu, D Zeng, H Yu, W Chen…",A data encryption and file sharing framework among microservices-based edge nodes with blockchain,2025,Peer-to-Peer Networking …,No,Excluded (E2): Technical system implementation without policy modeling
"D Lu, D Huang, A Walenstein…",A secure microservice framework for iot,2017,2017 IEEE symposium on …,No,Excluded (E2): Technical system implementation without policy modeling
"T Asik, YE Selcuk",Policy enforcement upon software based on microservice architecture,2017,2017 IEEE 15th International Conference on …,No,Excluded (E3): Out of scope for policy modeling or code generation
"S Jayaraman, A Singh",Best Practices in Microservices Architecture for Cross-Industry Interoperability,2024,International Journal of Computer Science …,No,Excluded (E3): Out of scope for policy modeling or code generation
"L Tang, H Hu, Z Wang, J Wang, Y Li",Microservice architecture design for big data in tactical cloud,2020,Big Data and Security: First …,No,Excluded (E3): Out of scope for policy modeling or code generation
"I Nadareishvili, R Mitra, M McLarty, M Amundsen","Microservice architecture: aligning principles, practices, and culture",2016,,No,Excluded (E3): Out of scope for policy modeling or code generation
"Z Li, D Seco, AE Sánchez Rodríguez",Microservice-oriented platform for internet of big data analytics: A proof of concept,2019,Sensors,No,Excluded (E3): Out of scope for policy modeling or code generation
"MD Hossain, T Sultana, S Akhter, MI Hossain, NT Thu…","The role of microservice approach in edge computing: Opportunities, challenges, and research directions",2023,ICT Express,No,Excluded (E3): Out of scope for policy modeling or code generation
"P Haindl, P Kochberger, M Sveggen",A systematic literature review of inter-service security threats and mitigation strategies in microservice architectures,2024,IEEE Access,No,Excluded (E3): Out of scope for policy modeling or code generation
"R Xu, SY Nikouei, Y Chen, E Blasch…",Blendmas: A blockchain-enabled decentralized microservices architecture for smart public safety,2019,2019 IEEE International …,No,Excluded (E2): Technical system implementation without policy modeling
N Coffing,Microservice architecture for identity and access management,2021,"US Patent 11,057,393",No,Excluded (E3): Out of scope for policy modeling or code generation
"D Da Silva, J Costa, B Assunção…",Microservice-based middleware for collaborative supply chain tracing,2020,2020 15th Iberian …,No,Excluded (E3): Out of scope for policy modeling or code generation
"Z Yang, P Nguyen, H Jin…",MIRAS: Model-based reinforcement learning for microservice resource allocation over scientific workflows,2019,2019 IEEE 39th …,No,Excluded (E3): Out of scope for policy modeling or code generation
"N Xi, J Liu, Y Li, B Qin",Decentralized access control for secure microservices cooperation with blockchain,2023,ISA transactions,No,Excluded (E2): Technical system implementation without policy modeling
"R Xu, GS Ramachandran, Y Chen…",Blendsm-ddm: Blockchain-enabled secure microservices for decentralized data marketplaces,2019,2019 IEEE …,No,Excluded (E2): Technical system implementation without policy modeling
"J Innerbichler, S Gonul…",NIMBLE collaborative platform: Microservice architectural approach to federated IoT,2017,2017 Global Internet …,No,Excluded (E2): Technical system implementation without policy modeling
"D Yu, Y Jin, Y Zhang, X Zheng",A survey on security issues in services communication of Microservices‐enabled fog applications,2019,Concurrency and Computation …,No,Excluded (E3): Out of scope for policy modeling or code generation
"N Singh, Y Hamid, S Juneja, G Srivastava…",Load balancing and service discovery using Docker Swarm for microservice based big data applications,2023,Journal of Cloud …,No,Excluded (E3): Out of scope for policy modeling or code generation
"M Krämer, S Frese, A Kuijper",Implementing secure applications in smart city clouds using microservices,2019,Future Generation Computer Systems,No,Excluded (E3): Out of scope for policy modeling or code generation
"M Vogel, T Bruckmeier, F Di Cerbo",General data protection regulation (GDPR) infrastructure for microservices and programming model,2020,"US Patent 10,839,099",No,Excluded (E3): Out of scope for policy modeling or code generation
"NC Sheffield, VR Bonazzi, PE Bourne, T Burdett…",From biomedical cloud platforms to microservices: next steps in FAIR data and analysis,2022,Scientific Data,No,Excluded (E3): Out of scope for policy modeling or code generation
"X Hou, C Li, J Liu, L Zhang, S Ren…","AlphaR: Learning-powered resource management for irregular, dynamic microservice graph",2021,2021 IEEE …,No,Excluded (E3): Out of scope for policy modeling or code generation
"Y Gao, G Casale, R Singhal",Performance Modeling of Distributed Data Processing in Microservice Applications,2024,ACM Transactions on Modeling and …,No,Excluded (E3): Out of scope for policy modeling or code generation
"F Guo, B Tang, M Tang, W Liang",Deep reinforcement learning-based microservice selection in mobile edge computing,2023,Cluster Computing,No,Excluded (E3): Out of scope for policy modeling or code generation
"R Xu, Y Chen, E Blasch, A Aved…",Hybrid blockchain-enabled secure microservices fabric for decentralized multi-domain avionics systems,2020,Sensors and Systems …,No,Excluded (E2): Technical system implementation without policy modeling
"MA Jarwar, S Ali, MG Kibria, S Kumar…",Exploiting interoperable microservices in web objects enabled Internet of Things,2017,… on Ubiquitous and …,No,Excluded (E3): Out of scope for policy modeling or code generation
"MJM Chowdhury, A Colman, J Han, MA Kabir",A policy framework for subject-driven data sharing,2018,,Yes,Selected as relevant primary study
"E Higgins, M Taylor, P Lisboa, F Arshad",Developing a data sharing framework: a case study,2014,"… : People, Process and Policy",No,Excluded (E3): Out of scope for policy modeling or code generation
"A Munoz-Arcentales, S López-Pernas, A Pozo, ...",An architecture for providing data usage and access control in data sharing ecosystems,2019,Procedia Computer …,No,Excluded (E3): Out of scope for policy modeling or code generation
"W Hofman, M Rajagopal",A technical framework for data sharing,2014,Journal of theoretical and applied …,No,Excluded (E3): Out of scope for policy modeling or code generation
"I Makhdoom, I Zhou, M Abolhasan, J Lipman, W Ni",PrivySharing: A blockchain-based framework for privacy-preserving and secure data sharing in smart cities,2020,Computers &Security,No,Excluded (E2): Technical system implementation without policy modeling
"P Eckersley, GF Egan, E De Schutter, T Yiyuan, ...",Neuroscience data and tool sharing: a legal and policy framework for neuroinformatics,2003,Neuroinformatics,No,Excluded (E1): Early publication
C Neylon,Building a culture of data sharing: policy design and implementation for research data management in development research,2017,Research Ideas and Outcomes,No,Excluded (E3): Out of scope for policy modeling or code generation
BM Knoppers,Framework for responsible sharing of genomic and health-related data,2014,The HUGO journal,No,Excluded (E3): Unrelated to policy modeling or microservice/code generation
"T Hardjono, DL Shrier, A Pentland","Trusted Data, revised and expanded edition: A New Framework for Identity and Data Sharing",2019,,No,Excluded (E3): Out of scope for policy modeling or code generation
"H Hu, GJ Ahn",Multiparty authorization framework for data sharing in online social networks,2011,… Annual Conference on Data and Applications Security …,No,Excluded (E1): Early publication
"K Spanaki, E Karafili, S Despoudi",AI applications of data sharing in agriculture 4.0: A framework for role-based data access control,2021,International Journal of Information …,No,Excluded (E3): Out of scope for policy modeling or code generation
"A Zuiderwijk, M Janssen","Open data policies, their implementation and impact: A framework for comparison",2014,Government information quarterly,No,Excluded (E3): Unrelated to policy modeling or microservice/code generation
"DW Chadwick, W Fan, G Costantino, ...",A cloud-edge based data security architecture for sharing and analysing cyber threat information,2020,Future generation …,No,Excluded (E3): Unrelated to policy modeling or microservice/code generation
"AR Rajput, Q Li, MT Ahvanooey",A blockchain-based secret-data sharing framework for personal health records in emergency condition,2021,Healthcare,No,Excluded (E2): Technical system implementation without policy modeling
"Y Zhang, D He, KKR Choo",BaDS: blockchain‐based architecture for data sharing with ABS and CP‐ABE in IoT,2018,Wireless Communications and …,No,Excluded (E2): Technical system implementation without policy modeling
"I Gupta, N Singh, AK Singh",Layer-based privacy and security architecture for cloud data sharing,2019,Journal of Communications Software and …,No,Excluded (E3): Out of scope for policy modeling or code generation
"P Arzberger, P Schroeder, A Beaulieu, G Bowker, ...",An international framework to promote access to data,2004,Science,No,Excluded (E1): Early publication
"D Bechtsis, N Tsolakis, E Iakovou, ...","Data-driven secure, resilient and sustainable supply chains: gaps, opportunities, and a new generalised data sharing and data monetisation framework",2022,International Journal of …,No,Excluded (E3): Out of scope for policy modeling or code generation
"J Shen, D Liu, J Shen, Q Liu, X Sun",A secure cloud-assisted urban data sharing framework for ubiquitous-cities,2017,Pervasive and mobile Computing,No,Excluded (E3): Out of scope for policy modeling or code generation
"Y Miao, Q Tong, KKR Choo, X Liu, ...",Secure online/offline data sharing framework for cloud-assisted industrial Internet of Things,2019,IEEE Internet of …,No,Excluded (E3): Out of scope for policy modeling or code generation
"S Wang, Y Zhang, Y Zhang",A blockchain-based framework for data sharing with fine-grained access control in decentralized storage systems,2018,Ieee Access,No,Excluded (E2): Technical system implementation without policy modeling
ES Dove,"Biobanks, data sharing, and the drive for a global privacy governance framework",2015,"Journal of Law, Medicine &Ethics",No,Excluded (E3): Out of scope for policy modeling or code generation
"J Strassner, WW Diab",A semantic interoperability architecture for Internet of Things data sharing and computing,2016,2016 IEEE 3rd World Forum on Internet …,No,Excluded (E3): Out of scope for policy modeling or code generation
"I Hrynaszkiewicz, N Simons, ...",Developing a research data policy framework for all journals and publishers,2020,Data Science …,No,Excluded (E3): Out of scope for policy modeling or code generation
"D Ferraiolo, V Atluri, S Gavrila",The Policy Machine: A novel architecture and framework for access control policy specification and enforcement,2011,Journal of Systems Architecture,No,Excluded (E1): Early publication
"P Nguyen, HH Nguyen, P Phung, HL Truong, ...",Advanced Context-Sensitive Access Management for Edge-Driven IoT Data Sharing as a Service,2025,ACM Transactions on …,No,Excluded (E2): Technical system implementation without policy modeling
"U Narayanan, V Paul, S Joseph",A novel system architecture for secure authentication and data sharing in cloud enabled Big Data Environment,2022,… of King Saud University-Computer and …,No,Excluded (E3): Out of scope for policy modeling or code generation
"A Mitrovska, B Shariati, P Safari, ...",Data governance framework for telemetry sharing,2024,ECOC 2024; 50th …,No,Excluded (E3): Unrelated to policy modeling or microservice/code generation
"D Frincke, D Tobin, J McConnell, ...",A framework for cooperative intrusion detection,1998,Proc. 21st NIST …,No,Excluded (E1): Early publication
"DS Sayogo, J Zhang, L Luna-Reyes, H Jarman, ...",Challenges and requirements for developing data architecture supporting integration of sustainable supply chains,2015,Information Technology …,No,Excluded (E3): Unrelated to policy modeling or microservice/code generation
"J Jin, GJ Ahn, H Hu, MJ Covington, ...",Patient-centric authorization framework for sharing electronic health records,2009,Proceedings of the 14th …,No,Excluded (E1): Early publication
"T Wang, Z Su, Y Xia, M Hamdi","Rethinking the data center networking: Architecture, network protocols, and resource sharing",2014,IEEE access,No,Excluded (E3): Unrelated to policy modeling or microservice/code generation
"E Coles, H Cheyne, J Rankin, B Daniel","Getting it right for every child: a national policy framework to promote children's well‐being in Scotland, United Kingdom",2016,The Milbank Quarterly,No,Excluded (E3): Out of scope for policy modeling or code generation
"C Dsouza, GJ Ahn, M Taguinod",Policy-driven security management for fog computing: Preliminary framework and a case study,2014,Proceedings of the 2014 IEEE …,No,Excluded (E3): Out of scope for policy modeling or code generation
D Patel,Research data management: a conceptual framework,2016,Library review,No,Excluded (E3): Unrelated to policy modeling or microservice/code generation
"AK Shrestha, J Vassileva",Blockchain-based research data sharing framework for incentivizing the data owners,2018,International Conference on Blockchain,No,Excluded (E2): Technical system implementation without policy modeling
"RK Mishra, RK Yadav, P Nath",Secure IoT data management and sharing architecture for information security using cryptographic technique,2023,Journal of Intelligent &Fuzzy …,No,Excluded (E2): Technical system implementation without policy modeling
"F Crespi, S Caravella, M Menghini, C Salvatori",European technological sovereignty: an emerging framework for policy strategy,2021,Intereconomics,No,Excluded (E3): Out of scope for policy modeling or code generation
"Y Hao, C Piao, Y Zhao, X Jiang",Privacy preserving government data sharing based on hyperledger blockchain,2019,International Conference on e-Business …,No,Excluded (E2): Technical system implementation without policy modeling
"M Smith, LM Lix, M Azimaee, JE Enns, ...",Assessing the quality of administrative data for research: a framework from the Manitoba Centre for Health Policy,2018,Journal of the …,No,Excluded (E3): Out of scope for policy modeling or code generation
JC Smart,Process and framework for facilitating data sharing using a distributed hypergraph,2018,"US Patent 9,996,567",No,Excluded (E3): Out of scope for policy modeling or code generation
"J Sun, L Ren, S Wang, X Yao",A blockchain-based framework for electronic medical records sharing with fine-grained access control,2020,Plos one,No,Excluded (E2): Technical system implementation without policy modeling
"Y Miao, X Liu, KKR Choo, RH Deng, ...",Fair and dynamic data sharing framework in cloud-assisted internet of everything,2019,IEEE Internet of Things …,No,Excluded (E3): Out of scope for policy modeling or code generation
"HK Tabor, BE Berkman, SC Hull, ...",Genomics really gets personal: how exome and whole genome sequencing challenge the ethical framework of human genetics research,2011,American Journal of …,No,Excluded (E1): Early publication
"Z Nedovic-Budic, JK Pinto",Understanding interorganizational GIS activities: A conceptual framework,1999,Urisa-Washington Dc-,No,Excluded (E1): Early publication
"A Oltramari, D Piraviperumal, F Schaub, ...",PrivOnto: a semantic framework for the analysis of privacy policies,2018,Semantic …,No,Excluded (E3): Out of scope for policy modeling or code generation
"D Whicher, M Ahmed, S Siddiqui, I Adams…",Health data sharing to support better outcomes,2020,"… , DC: National Academy …",No,Excluded (E3): Out of scope for policy modeling or code generation
"A Blasimme, M Fadda, M Schneider, E Vayena",Data sharing for precision medicine: policy lessons and future directions,2018,Health Affairs,No,Excluded (E3): Out of scope for policy modeling or code generation
"N Waithira, B Mutinda, PY Cheah",Data management and sharing policy: the first step towards promoting data sharing,2019,BMC medicine,No,Excluded (E3): Out of scope for policy modeling or code generation
"F Rezaeibagha, Y Mu",Distributed clinical data sharing via dynamic access-control policy transformation,2016,International journal of medical informatics,Yes,Selected as relevant primary study
"ES Dove, M Phillips","Privacy law, data sharing policies, and medical data: a comparative perspective",2015,Medical data privacy handbook,No,Excluded (E5): Ethical/conceptual discussion without technical contribution
"KK Kim, JG Joseph…",Comparison of consumers' views on electronic data sharing for healthcare and research,2015,Journal of the American …,No,Excluded (E3): Out of scope for policy modeling or code generation
F Alfonso,Data sharing,2017,,No,Excluded (E3): Out of scope for policy modeling or code generation
LA Moon,Factors influencing health data sharing preferences of consumers: A critical review,2017,Health policy and technology,No,Excluded (E3): Out of scope for policy modeling or code generation
"V Papageorgiou, A Wharton-Smith, I Campos-Matos…",Patient data-sharing for immigration enforcement: a qualitative study of healthcare providers in England,2020,BMJ open,No,Excluded (E3): Unrelated to policy modeling or microservice/code generation
"S Banerjee, T Hemphill, P Longstreet",Wearable devices and healthcare: Data sharing and privacy,2018,The Information Society,No,Excluded (E3): Out of scope for policy modeling or code generation
"A Panagopoulos, T Minssen, K Sideri, H Yu…",Incentivizing the sharing of healthcare data in the AI Era,2022,Computer Law & …,No,Excluded (E3): Unrelated to policy modeling or microservice/code generation
"HL Rehm, AJH Page, L Smith, JB Adams, G Alterovitz…",GA4GH: International policies and standards for data sharing across genomic research and healthcare,2021,Cell genomics,No,Excluded (E3): Out of scope for policy modeling or code generation
"L Fang, C Yin, J Zhu, C Ge, M Tanveer…",Privacy protection for medical data sharing in smart healthcare,2020,ACM Transactions on …,No,Excluded (E3): Out of scope for policy modeling or code generation
"A Youssef, MY Ng, J Long…",Organizational factors in clinical data sharing for artificial intelligence in health care,2023,JAMA Network …,No,Excluded (E3): Out of scope for policy modeling or code generation
"B Malin, D Karp…",Technical and policy approaches to balancing patient privacy and data sharing in clinical and translational research,2010,Journal of Investigative …,No,Excluded (E1): Early publication
"I Matteucci, P Mori, M Petrocchi…",Controlled data sharing in E-health,2011,2011 1st Workshop on …,No,Excluded (E1): Early publication
"RE Foraker, AM Lai, TG Kannampallil…",Transmission dynamics: data sharing in the COVID‐19 era,2021,Learning Health …,No,Excluded (E3): Out of scope for policy modeling or code generation
"A Kharlamov, R Hohmann, G Parry",Data sharing decisions: Perceptions and intentions in healthcare,2023,Strategic Change,No,Excluded (E3): Out of scope for policy modeling or code generation
"J Bowles, T Webber, E Blackledge…",A blockchain-based healthcare platform for secure personalised data sharing,2021,Public Health and …,No,Excluded (E2): Technical system implementation without policy modeling
"JWTM de Kok, MÁA de la Hoz, Y de Jong, V Brokke…",A guide to sharing open healthcare data under the General Data Protection Regulation,2023,Scientific data,No,Excluded (E3): Unrelated to policy modeling or microservice/code generation
"L Savage, M Gaynor, J Adler-Milstein",Digital health data and information sharing: A new frontier for health care competition,2018,Antitrust LJ,No,Excluded (E3): Unrelated to policy modeling or microservice/code generation
"S Courbier, R Dimond, V Bros-Facer",Share and protect our health data: an evidence based approach to rare disease patients' perspectives on data sharing and data protection-quantitative survey …,2019,Orphanet journal of rare diseases,No,Excluded (E5): Ethical/conceptual discussion without technical contribution
"J Adler-Milstein, AK Jha",Sharing clinical data electronically: a critical challenge for fixing the health care system,2012,JAMA,No,Excluded (E1): Early publication
"A Choudhury, C Sun, A Dekker, M Dumontier…","Privacy-preserving federated data analysis: data sharing, protection, and bioethics in healthcare",2022,Machine and Deep …,No,Excluded (E3): Out of scope for policy modeling or code generation
"RD Jones, C Krenz, KA Griffith, R Spence…","Patient experiences, trust, and preferences for health data sharing",2022,JCO Oncology …,No,Excluded (E3): Out of scope for policy modeling or code generation
"S Kalkman, M Mostert, C Gerlinger, JJM van Delden…",Responsible data sharing in international health research: a systematic review of principles and norms,2019,BMC medical …,No,Excluded (E5): Ethical/conceptual discussion without technical contribution
"Q Huang, L Wang, Y Yang",Secure and privacy‐preserving data sharing and collaboration in Mobile healthcare social networks of smart cities,2017,Security and Communication …,No,Excluded (E3): Out of scope for policy modeling or code generation
M Shabani,Will the European Health Data Space change data sharing rules?,2022,Science,No,Excluded (E3): Out of scope for policy modeling or code generation
"A Rowhani-Farid, M Allen, AG Barnett",What incentives increase data sharing in health and medical research? A systematic review,2017,Research integrity and peer review,No,Excluded (E5): Ethical/conceptual discussion without technical contribution
"M Raj, K Ryan, PS Amara, P Nong, K Calhoun…",Policy preferences regarding health data sharing among patients with cancer: public deliberations,2023,JMIR cancer,No,Excluded (E3): Out of scope for policy modeling or code generation
"H Wimmer, VY Yoon, V Sugumaran",A multi-agent system to support evidence based medicine and clinical decision making via data sharing and data privacy,2016,Decision Support Systems,No,Excluded (E3): Out of scope for policy modeling or code generation
"O Lounsbury, L Roberts, JR Goodman, P Batey…",Opening a “can of worms” to explore the public's hopes and fears about health care data sharing: Qualitative study,2021,Journal of Medical …,No,Excluded (E3): Out of scope for policy modeling or code generation
"E Tweed, K Cimova, P Craig, M Allik…",Unlocking data: Decision-maker perspectives on cross-sectoral data sharing and linkage as part of a whole-systems approach to public health policy and practice,2024,Public Health …,No,Excluded (E5): Ethical/conceptual discussion without technical contribution
"CL Cole, S Sengupta, S Rossetti…",Ten principles for data sharing and commercialization,2021,Journal of the …,No,Excluded (E3): Out of scope for policy modeling or code generation
"D Rankin, M Black, R Bond, J Wallace…",Reliability of supervised machine learning using synthetic data in health care: model to preserve privacy for data sharing,2020,JMIR medical …,No,Excluded (E3): Out of scope for policy modeling or code generation
"Y Wang, B Blobel, B Yang",Reinforcing health data sharing through data democratization,2022,Journal of Personalized Medicine,No,Excluded (E3): Out of scope for policy modeling or code generation
"R Gupta, P Kanungo, N Dagdee, G Madhu, KS Sahoo…",Secured and privacy-preserving multi-authority access control system for cloud-based healthcare data sharing,2023,Sensors,No,Excluded (E3): Out of scope for policy modeling or code generation
"KP Seastedt, P Schwab, Z O'Brien, E Wakida…","Global healthcare fairness: We should be sharing more, not less, data",2022,PLOS Digital …,No,Excluded (E3): Unrelated to policy modeling or microservice/code generation
"A Pugazhenthi, D Chitra",Data access control and secured data sharing approach for health care data in cloud environment,2019,Journal of medical systems,No,Excluded (E3): Out of scope for policy modeling or code generation
"M Habib, MA Kabir, L Zheng",LEISA: A Scalable Microservice-based System for Efficient Livestock Data Sharing,2025,arXiv preprint arXiv:2501.14781,Yes,Selected as relevant primary study
"A Smid, R Wang, T Cerny",Case study on data communication in microservice architecture,2019,Proceedings of the Conference on Research …,No,Excluded (E3): Out of scope for policy modeling or code generation
"S Roca, J Sancho, J García, Á Alesanco",Microservice chatbot architecture for chronic patient support,2020,Journal of biomedical informatics,No,Excluded (E3): Out of scope for policy modeling or code generation
