Authors,Title,Year,Source,Inclusion Decision,Reason
"K Miao, J Li, W Hong, M Chen",A Microservice‐Based Big Data Analysis Platform for Online Educational Applications,2020,Scientific Programming,No,Excluded (E3): Out of scope for policy modeling or code generation
"JA Bigheti, MM Fernandes…",Control as a service: a microservice approach to Industry 4.0,2019,2019 II Workshop on …,No,Excluded (E3): Out of scope for policy modeling or code generation
"A Furda, C Fidge, O Zimmermann, W Kelly…","Migrating enterprise legacy source code to microservices: on multitenancy, statefulness, and data consistency",2017,Ieee …,No,Excluded (E3): Out of scope for policy modeling or code generation
"H Liu, L Qi, S Shen, AA Khan…",Microservice‐driven privacy‐aware cross‐platform social relationship prediction based on sequential information,2024,software: Practice and …,No,Excluded (E3): Out of scope for policy modeling or code generation
"K Munonye, P Martinek",Evaluation of data storage patterns in microservices archicture,2020,2020 IEEE 15th International …,No,Excluded (E3): Out of scope for policy modeling or code generation
"W Lu, Q Xu, C Lan, L Lyu, Y Zhou…",Microservice‐Based Platform for Space Situational Awareness Data Analytics,2020,International Journal of …,No,Excluded (E3): Out of scope for policy modeling or code generation
"J Lian, M Gao",Design and implementation of network information service platform based on microservice architecture,2020,Journal of Physics: Conference Series,No,Excluded (E3): Out of scope for policy modeling or code generation
"N Alshuqayran, N Ali, R Evans",A systematic mapping study in microservice architecture,2016,2016 IEEE 9th international …,No,Excluded (E3): Out of scope for policy modeling or code generation
"G Sebastián, JA Gallud, R Tesoriero",Code generation using model driven architecture: A systematic mapping study,2020,Journal of Computer Languages,No,Excluded (E3): Out of scope for policy modeling or code generation
"A Mehmood, DNA Jawawi",Aspect-oriented model-driven code generation: A systematic mapping study,2013,Information and Software Technology,No,Excluded (E3): Out of scope for policy modeling or code generation
"D Gurunule, M Nashipudimath",A review: analysis of aspect orientation and model driven engineering for code generation,2015,Procedia Computer Science,No,Excluded (E3): Out of scope for policy modeling or code generation
"MJ Rutherford, AL Wolf",A case for test-code generation in model-driven systems,2003,International Conference on Generative …,No,Excluded (E1): Early publication
"JA Barriga, PJ Clemente, MA Pérez-Toledano…","Design, code generation and simulation of IoT environments with mobility devices by using model-driven development: SimulateIoT-Mobile",2023,Pervasive and Mobile …,No,Excluded (E2): Technical system implementation without policy modeling
"MK Shiferaw, AK Jena",Code generator for model-driven software development using UML models,2018,2018 Second International Conference …,No,Excluded (E3): Out of scope for policy modeling or code generation
"M Bhadra, DS Lopera, R Kunzelmann…",A model-driven architecture approach to accelerate software code generation,2024,2024 7th International …,No,Excluded (E3): Out of scope for policy modeling or code generation
A Wąsowski,Code generation and model driven development for constrained embedded software,2005,,No,Excluded (E1): Early publication
"M Nassar, A Anwar, S Ebersold, B Elasri…",Code generation in VUML profile: A model driven approach,2009,2009 IEEE/ACS …,No,Excluded (E1): Early publication
M Völter,Best practices for DSLs and model-driven development,2009,Journal of Object Technology,No,Excluded (E1): Early publication
"M Bhadra, D Albert, U Yun…",A model-driven architecture approach to efficient and adaptable software code generation,2024,MBMV 2024; 27 …,No,Excluded (E3): Out of scope for policy modeling or code generation
"Ó Pastor, S España",Full model-driven practice: from requirements to code generation,2012,"… : 24th International Conference, CAiSE 2012, Gdansk …",No,Excluded (E1): Early publication
S Jörges,Construction and evolution of code generators: A model-driven and service-oriented approach,2013,,No,Excluded (E3): Out of scope for policy modeling or code generation
S Philippi,Automatic code generation from high-level Petri-Nets for model driven systems engineering,2006,Journal of Systems and Software,No,Excluded (E1): Early publication
"PE Papotti, AF do Prado, WL de Souza…",A quantitative analysis of model-driven code generation through software experimentation,2013,"… , CAiSE 2013, Valencia …",No,Excluded (E3): Out of scope for policy modeling or code generation
"J Bennett, K Cooper, L Dai",Aspect-oriented model-driven skeleton code generation: A graph-based transformation approach,2010,Science of Computer Programming,No,Excluded (E1): Early publication
"JO Ringert, A Roth, B Rumpe…",Language and code generator composition for model-driven engineering of robotics component &connector systems,2015,Journal of Software …,No,Excluded (E3): Out of scope for policy modeling or code generation
"J Ruiz, E Serral, M Snoeck",Evaluating user interface generation approaches: model-based versus model-driven development,2019,Software &Systems Modeling,No,Excluded (E3): Out of scope for policy modeling or code generation
"A Calderón, J Boubeta-Puig, M Ruiz","MEdit4CEP-Gam: A model-driven approach for user-friendly gamification design, monitoring and code generation in CEP-based systems",2018,Information and Software Technology,No,Excluded (E3): Out of scope for policy modeling or code generation
"A Schmidt, D Kimmig, K Bittner…","Teaching model-driven software development: revealing the"" great miracle"" of code generation to students",2014,… of the Sixteenth …,No,Excluded (E3): Out of scope for policy modeling or code generation
"M Jurgelaitis, R Butkienė",Solidity code generation from UML state machines in model-driven smart contract development,2022,IEEE Access,No,Excluded (E3): Out of scope for policy modeling or code generation
"D Kaestner, C Rustemeier, U Kiffmeier, D Fleischer…",Model-driven code generation and analysis,2014,,No,Excluded (E3): Out of scope for policy modeling or code generation
"PW Burke, P Sweany",Automatic code generation through model-driven design,2007,"University of North Texas, Denton, Texas",No,Excluded (E1): Early publication
DC Schmidt,Model-driven engineering,2006,Computer-IEEE Computer Society-,No,Excluded (E1): Early publication
"N Moebius, K Stenzel, H Grandy…",Model-driven code generation for secure smart card applications,2009,2009 Australian Software …,No,Excluded (E1): Early publication
"M Brambilla, J Cabot, M Wimmer",Model-driven software engineering in practice,2017,,No,Excluded (E3): Out of scope for policy modeling or code generation
"D Gessenharter, M Rauscher",Code Generation for UML 2 Activity Diagrams: Towards a Comprehensive Model-driven Development Approach,2011,"… , ECMFA 2011, Birmingham, UK, June 6-9 …",No,Excluded (E1): Early publication
"B Steffen, T Margaria, R Nagel, S Jörges…",Model-driven development with the jABC,2006,Haifa verification …,No,Excluded (E1): Early publication
"SJ Mellor, AN Clark, T Futagami",Model-driven development,2003,IEEE software,No,Excluded (E1): Early publication
"C Schlegel, T Haßler, A Lotz…",Robotic software systems: From code-driven to model-driven designs,2009,… Conference on Advanced …,No,Excluded (E1): Early publication
"AR Sadik, S Brulin, M Olhofer, A Ceravola…",LLM as a code generator in Agile Model Driven Development,2024,arXiv preprint arXiv …,No,Excluded (E3): Unrelated to policy modeling or microservice/code generation
"D Alonso, C Vicente-Chicote, P Sánchez…",Automatic Ada code generation using a model-driven engineering approach,2007,… Conference on Reliable …,No,Excluded (E1): Early publication
"S Raedler, M Rupp, E Rigger…",Code generation for machine learning using model-driven engineering and sysml,2023,arXiv preprint arXiv …,No,Excluded (E3): Out of scope for policy modeling or code generation
"BP Lamancha, P Reales, M Polo, D Caivano",Model-driven test code generation,2011,International Conference on …,No,Excluded (E1): Early publication
"E Falzone, C Bernaschina",Intelligent code generation for model driven web development,2018,Current Trends in Web Engineering: ICWE …,No,Excluded (E3): Out of scope for policy modeling or code generation
"M Krunic, I Letvencuk, I Povazan…",An approach to model driven development and automatic source code generation of GUI controls,2013,2013 IEEE 11th …,No,Excluded (E3): Out of scope for policy modeling or code generation
"C Schlegel, A Steck, A Lotz",Robotic software systems: From code-driven to model-driven software development,2012,Robotic Systems-Applications …,No,Excluded (E1): Early publication
"K Balasubramanian, A Gokhale, G Karsai…",Developing applications using model-driven design environments,2006,Computer,No,Excluded (E1): Early publication
"J Klein, H Levinson, J Marchetti",Model-driven engineering: Automatic code generation and beyond,2015,CMU/SEI-2015-TN-005,No,Excluded (E3): Out of scope for policy modeling or code generation
"M Skotnica, J Klicpera, R Pergl",Towards model-driven smart contract systems-code generation and improving expressivity of smart contract modeling,2020,Proc. EEWC,No,Excluded (E3): Out of scope for policy modeling or code generation
"M Anastaspoulos, T Forster, D Muthig",Optimizing model-driven development by deriving code generation patterns from product line architectures,2005,NetObject Days 2005,No,Excluded (E1): Early publication
"WJ Ray, A Farrar",Object model driven code generation for the enterprise,2001,… on Rapid System Prototyping. RSP 2001,No,Excluded (E1): Early publication
"C Schlegel, A Steck, D Brugali, A Knoll",Design abstraction and processes in robotics: From code-driven to model-driven engineering,2010,"Simulation, Modeling, and …",No,Excluded (E1): Early publication
"JO Ringert, A Roth, B Rumpe, A Wortmann",Code generator composition for model-driven engineering of robotics component &connector systems,2015,arXiv preprint arXiv …,No,Excluded (E3): Out of scope for policy modeling or code generation
E Posse,PapyrusRT: modelling and code generation,2015,Workshop on Open Source for Model Driven …,No,Excluded (E3): Out of scope for policy modeling or code generation
"D Basin, M Clavel, M Egea",A decade of model-driven security,2011,Proceedings of the 16th ACM symposium …,No,Excluded (E1): Early publication
"S Giallorenzo, F Montesi…",Model-Driven Code Generation for Microservices: Service Models.,2023,… of the Third and …,Yes,Selected as relevant primary study
"AZ Javed, PA Strooper…",Automated generation of test cases using model-driven architecture,2007,… International Workshop on …,No,Excluded (E1): Early publication
"K Yotov, X Li, G Ren, M Cibulskis, G DeJong…",A comparison of empirical and model-driven optimization,2003,Proceedings of the …,No,Excluded (E1): Early publication
